{
  "$schema": "test-surface-scorecards.schema.json",
  "schemaVersion": 1,
  "manifestId": "hxc-test-surfaces-v1",
  "capabilityAuthority": "docs/specs/bootstrap-inventory.json",
  "policyOnlyOwners": [
    "snapshots:catalog",
    "test:agent-instructions",
    "test:beads-plan",
    "test:capabilities",
    "test:fixture-policy",
    "test:governance",
    "test:governance-policy",
    "test:research-bundle",
    "test:security-tooling",
    "test:toolchain-shards",
    "test:typed-boundaries"
  ],
  "surfaces": [
    {
      "id": "compiler-admitted-slices",
      "name": "Explicitly admitted Haxe-to-C compiler slices",
      "archetype": "compiler",
      "status": "admitted-slice",
      "ownerBeads": [
        "E2.T10",
        "E3.T10"
      ],
      "protectedClaims": [
        "Only capability-manifest slices with real typed-Haxe lowering, strict C build, and runtime evidence are admitted.",
        "Official Haxe qualification applies only to explicitly mapped admitted scope."
      ],
      "capabilityIds": [
        "general-haxe-lowering",
        "primitive-executable-lowering",
        "literal-string-output",
        "closed-anonymous-record-lowering",
        "tagged-enum-lowering",
        "class-layout",
        "constructor-lowering",
        "virtual-dispatch",
        "generic-specialization"
      ],
      "focusedOwners": [
        "test:body-lowering",
        "test:function-lowering",
        "test:incremental-backend",
        "test:aggregate-lowering",
        "test:enum-lowering",
        "test:span-lowering",
        "test:string-runtime"
      ],
      "verticalOwners": [
        "test:hello",
        "test:caxecraft-actor-composition",
        "test:caxecraft-resolved-level-plan",
        "test:caxecraft-content-generation",
        "test:caxecraft-runtime-level-loader",
        "test:caxecraft-session",
        "test:caxecraft-aquatics",
        "test:caxecraft-inventory",
        "test:caxecraft-pilot",
        "test:caxecraft-content-json",
        "test:caxecraft-package-manifest",
        "test:caxecraft-package-zip-source",
        "test:caxecraft-package-zip-export",
        "test:caxecraft-runtime-schemas",
        "test:caxecraft-runtime-content-generation",
        "test:caxecraft-runtime-piloscript",
        "test:caxecraft-campaign-runtime",
        "test:caxecraft-domain"
      ],
      "systemOwners": [
        "test:caxecraft-playable",
        "test:caxecraft-campaign-graphical",
        "test:caxecraft-adventure-journey"
      ],
      "affectedExtendedOwners": [
        "test:primitive-differential",
        "test:caxecraft-domain:full"
      ],
      "oracles": [
        "Pinned Haxe Eval differential traces for shared Haxe semantics",
        "Manually reviewed HxcIR and generated-C expectations paired with strict native execution"
      ],
      "evidence": [
        {
          "path": "examples/hello/case.json",
          "proves": "One ordinary Haxe literal-output tracer crosses haxe.c, strict C11, and a native runtime observer.",
          "doesNotProve": "General Haxe lowering, general String support, platform support, or a stable public ABI."
        },
        {
          "path": "test/differential/string-runtime/case.json",
          "proves": "The bounded String suite proves fresh decoded enum carriers and retained String payload aliases with Eval, strict native execution, and sanitizer observers; the enum suite separately proves the synchronous String constructor-callback adapter.",
          "doesNotProve": "Other managed or recursive enum-constructor callback payloads, full standard-library String behavior, or general Haxe lowering."
        },
        {
          "path": "test/differential/bytes-runtime/case.json",
          "proves": "The bounded Bytes suite proves borrowed and fresh Bytes values cross compiler-generated switch and conditional joins, while an explicit nullable local preserves absent, present-empty, and present-non-empty states through checked unwrap, replacement, and cleanup, using Eval, validated HxcIR, strict native execution, and sanitizer observers.",
          "doesNotProve": "Nullable Bytes parameters, returns, fields, or other erased-null storage shapes; full standard-library Bytes behavior; a public ABI; platform qualification; or general Haxe lowering."
        },
        {
          "path": "examples/caxecraft/test/caxecraft/qa/ContentJsonProbe.hx",
          "proves": "One bounded ordinary-Haxe JSON codec crosses the admitted enum, class, Array, Bytes, and String slices through strict generated C.",
          "doesNotProve": "General Haxe lowering, a general JSON library, runtime pack loading, public ABI stability, or platform qualification."
        },
        {
          "path": "examples/caxecraft/test/caxecraft/qa/ContentPackageManifestProbe.hx",
          "proves": "One typed package-role and receipt model crosses bounded JSON, the confined directory source, haxe.c, strict native C, and every declared first-adventure payload.",
          "doesNotProve": "General Haxe lowering, ZIP transport, arbitrary mod activation, dependency resolution, public ABI stability, or platform qualification."
        },
        {
          "path": "examples/caxecraft/test/caxecraft/qa/ContentPackageZipSourceProbe.hx",
          "proves": "One frozen independently produced stored ZIP crosses the Haxe-authored bounded parser, the transport-neutral package verifier, haxe.c, strict native C, and a real observer with 36 fail-closed archive mutations.",
          "doesNotProve": "Current-package directory parity, general Haxe lowering, general haxe.zip support, Deflate, deterministic export, complete asset handoff, arbitrary mod activation, public ABI stability, or platform qualification."
        },
        {
          "path": "examples/caxecraft/test/caxecraft/qa/ContentPackageZipExportProbe.hx",
          "proves": "One admitted Haxe slice verifies a complete campaign/level/pack/localization/asset package, writes a deterministic stored ZIP, reopens it through the bounded reader, and preserves the exact package identity through strict native C.",
          "doesNotProve": "General Haxe lowering, general haxe.zip support, Deflate, arbitrary package compatibility, mod installation or activation, public ABI stability, or platform qualification."
        },
        {
          "path": "examples/caxecraft/test/caxecraft/qa/RuntimeSchemasProbe.hx",
          "proves": "The checked-in content and UI bytes cross the package store, bounded JSON codec, exact target-owned schemas, immutable registry/catalog, strict generated C, and a real runtime observer.",
          "doesNotProve": "General Haxe lowering, arbitrary pack compatibility, publication into the running game, public ABI stability, or platform qualification."
        },
        {
          "path": "examples/caxecraft/test/caxecraft/qa/RuntimeContentGenerationProbe.hx",
          "proves": "One admitted ordinary-Haxe slice verifies exact package receipts, hashes real source bytes, decodes pack and UI schemas, resolves a real map, and constructs one unpublished generation through strict generated C.",
          "doesNotProve": "General Haxe lowering, arbitrary package compatibility, live renderer publication, public ABI stability, or platform qualification."
        },
        {
          "path": "examples/caxecraft/test/caxecraft/qa/RuntimeContentPublicationProbe.hx",
          "proves": "The fast Eval owner proves failed-load invariance, successful replacement, retained retired views, and exact stale/duplicate rejection; the paired runtime-content-generation tracer carries that owner through haxe.c, strict generated C, and a native observer without compiling the package graph twice.",
          "doesNotProve": "General Haxe lowering, renderer String interop, arbitrary hot reload, public ABI stability, or platform qualification."
        }
      ],
      "selectorOwnership": {
        "semanticOwners": [
          "compiler frontend, HxcIR, lowering, representation, and generated-project planning"
        ],
        "affectedRing": "R3",
        "unknownFallback": "R4"
      },
      "fullBackstopCommand": "npm run test:toolchain:parallel -- --with-native",
      "releaseCommand": null,
      "lastObserved": {
        "state": "bounded-green",
        "evidence": "haxe_c-xge.20.4.4.3: test:caxecraft-package-zip-export passes complete deterministic package export and isolated handoff through the admitted Bytes/String/Array/class/enum slice on Eval and strict native C with sanitizers."
      },
      "residualRisks": [
        "General Haxe-to-C remains unsupported in the capability manifest.",
        "The official Haxe suite adapter remains readiness-only under haxe_c-6k7."
      ]
    },
    {
      "id": "c-abi-native-ffi",
      "name": "C ABI, native/metal, and foreign-function behavior",
      "archetype": "native-metal",
      "status": "partial",
      "ownerBeads": [
        "E6.T01",
        "E7.T01",
        "E7.T03"
      ],
      "protectedClaims": [
        "Typed direct-C imports and native fixture ABIs are proven only for their declared headers and consumers.",
        "Independent native C or C++ evidence does not create a generated public ABI claim."
      ],
      "capabilityIds": [
        "direct-c-import",
        "native-interop-fixtures",
        "bindgen",
        "c-export",
        "public-c-abi"
      ],
      "focusedOwners": [
        "test:c-import",
        "test:typed-c",
        "test:raygui-binding"
      ],
      "verticalOwners": [
        "test:raylib-provisioning",
        "test:build-adapters",
        "test:caxecraft-runtime-level-loader",
        "test:caxecraft-package-manifest",
        "test:caxecraft-package-zip-export",
        "test:caxecraft-runtime-content-generation",
        "test:caxecraft-runtime-piloscript",
        "test:caxecraft-campaign-runtime"
      ],
      "systemOwners": [
        "test:caxecraft-playable",